[
  {
    "vocab_id": "vocab_vav",
    "hebrew": "?",
    "normalized_hebrew": "?",
    "transliteration_optional": null,
    "gloss_primary": "and",
    "gloss_alternates": [],
    "shoresh": null,
    "part_of_speech": "conjunction",
    "function_vs_content": "function",
    "priority_band": "must_master_first",
    "frequency_signal": "recurring_across_resources",
    "linked_skill_ids": [
      "skill_function_word_recognition",
      "skill_prefix_handling",
      "skill_vav_hahipuch_recognition"
    ],
    "source_refs": [
      "R1:worksheets",
      "R2:worksheets",
      "R3:pp8-35"
    ],
    "notes": "High-value function word; may also participate in tense-sensitive verb patterns."
  },
  {
    "vocab_id": "vocab_bet_prefix",
    "hebrew": "?",
    "normalized_hebrew": "?",
    "transliteration_optional": null,
    "gloss_primary": "in / with",
    "gloss_alternates": [],
    "shoresh": null,
    "part_of_speech": "prefix_morpheme",
    "function_vs_content": "function",
    "priority_band": "must_master_first",
    "frequency_signal": "recurring_across_resources",
    "linked_skill_ids": [
      "skill_function_word_recognition",
      "skill_prefix_handling"
    ],
    "source_refs": [
      "R1:worksheets",
      "R2:worksheets"
    ],
    "notes": null
  },
  {
    "vocab_id": "vocab_lamed_prefix",
    "hebrew": "?",
    "normalized_hebrew": "?",
    "transliteration_optional": null,
    "gloss_primary": "to / for",
    "gloss_alternates": [],
    "shoresh": null,
    "part_of_speech": "prefix_morpheme",
    "function_vs_content": "function",
    "priority_band": "must_master_first",
    "frequency_signal": "recurring_across_resources",
    "linked_skill_ids": [
      "skill_function_word_recognition",
      "skill_prefix_handling"
    ],
    "source_refs": [
      "R1:worksheets",
      "R2:worksheets"
    ],
    "notes": null
  },
  {
    "vocab_id": "vocab_mem_prefix",
    "hebrew": "?",
    "normalized_hebrew": "?",
    "transliteration_optional": null,
    "gloss_primary": "from",
    "gloss_alternates": [],
    "shoresh": null,
    "part_of_speech": "prefix_morpheme",
    "function_vs_content": "function",
    "priority_band": "must_master_first",
    "frequency_signal": "recurring_across_resources",
    "linked_skill_ids": [
      "skill_function_word_recognition",
      "skill_prefix_handling"
    ],
    "source_refs": [
      "R1:worksheets",
      "R2:worksheets"
    ],
    "notes": "Often appears as a reduced form of ??."
  },
  {
    "vocab_id": "vocab_min",
    "hebrew": "??",
    "normalized_hebrew": "??",
    "transliteration_optional": null,
    "gloss_primary": "from",
    "gloss_alternates": [],
    "shoresh": null,
    "part_of_speech": "preposition",
    "function_vs_content": "function",
    "priority_band": "must_master_first",
    "frequency_signal": "recurring_across_resources",
    "linked_skill_ids": [
      "skill_function_word_recognition",
      "skill_prefix_handling"
    ],
    "source_refs": [
      "R1:worksheets",
      "R2:p1"
    ],
    "notes": "Useful because it alternates with reduced prefix forms."
  },
  {
    "vocab_id": "vocab_el",
    "hebrew": "??",
    "normalized_hebrew": "??",
    "transliteration_optional": null,
    "gloss_primary": "to",
    "gloss_alternates": [
      "toward"
    ],
    "shoresh": null,
    "part_of_speech": "preposition",
    "function_vs_content": "function",
    "priority_band": "must_master_first",
    "frequency_signal": "recurring_across_resources",
    "linked_skill_ids": [
      "skill_function_word_recognition",
      "skill_phrase_translation"
    ],
    "source_refs": [
      "R1:worksheets",
      "R2:worksheets"
    ],
    "notes": null
  },
  {
    "vocab_id": "vocab_et",
    "hebrew": "??",
    "normalized_hebrew": "??",
    "transliteration_optional": null,
    "gloss_primary": "object marker",
    "gloss_alternates": [
      "with"
    ],
    "shoresh": null,
    "part_of_speech": "particle",
    "function_vs_content": "function",
    "priority_band": "must_master_first",
    "frequency_signal": "recurring_across_resources",
    "linked_skill_ids": [
      "skill_function_word_recognition",
      "skill_phrase_translation"
    ],
    "source_refs": [
      "R2:worksheets",
      "R3:review_structure"
    ],
    "notes": "Context decides whether to render it or leave it implicit in English."
  },
  {
    "vocab_id": "vocab_ki",
    "hebrew": "??",
    "normalized_hebrew": "??",
    "transliteration_optional": null,
    "gloss_primary": "that / because / for",
    "gloss_alternates": [],
    "shoresh": null,
    "part_of_speech": "particle",
    "function_vs_content": "function",
    "priority_band": "early_useful",
    "frequency_signal": "contextual_only",
    "linked_skill_ids": [
      "skill_function_word_recognition",
      "skill_contextual_translation"
    ],
    "source_refs": [
      "R3:throughout"
    ],
    "notes": "Low standalone value; stronger in phrase context."
  },
  {
    "vocab_id": "vocab_lo",
    "hebrew": "??",
    "normalized_hebrew": "??",
    "transliteration_optional": null,
    "gloss_primary": "not",
    "gloss_alternates": [],
    "shoresh": null,
    "part_of_speech": "particle",
    "function_vs_content": "function",
    "priority_band": "must_master_first",
    "frequency_signal": "recurring_across_resources",
    "linked_skill_ids": [
      "skill_function_word_recognition",
      "skill_phrase_translation"
    ],
    "source_refs": [
      "R1:worksheets",
      "R3:throughout"
    ],
    "notes": null
  },
  {
    "vocab_id": "vocab_amar",
    "hebrew": "???",
    "normalized_hebrew": "???",
    "transliteration_optional": null,
    "gloss_primary": "say",
    "gloss_alternates": [
      "speak"
    ],
    "shoresh": "???",
    "part_of_speech": "verb",
    "function_vs_content": "content",
    "priority_band": "must_master_first",
    "frequency_signal": "recurring_across_resources",
    "linked_skill_ids": [
      "skill_shoresh_identification",
      "skill_tense_recognition",
      "skill_literal_translation"
    ],
    "source_refs": [
      "R2:worksheets",
      "R3:p60"
    ],
    "notes": "Core grammar carrier; low-value as a bare-form shoresh item."
  },
  {
    "vocab_id": "vocab_shamar",
    "hebrew": "???",
    "normalized_hebrew": "???",
    "transliteration_optional": null,
    "gloss_primary": "guard / keep",
    "gloss_alternates": [],
    "shoresh": "???",
    "part_of_speech": "verb",
    "function_vs_content": "content",
    "priority_band": "must_master_first",
    "frequency_signal": "recurring_across_resources",
    "linked_skill_ids": [
      "skill_shoresh_identification",
      "skill_tense_recognition",
      "skill_present_habitual_recognition"
    ],
    "source_refs": [
      "R3:p27",
      "R3:pp118-124"
    ],
    "notes": "Used repeatedly as a clean teaching verb in the extracted rule spine."
  },
  {
    "vocab_id": "vocab_raah",
    "hebrew": "???",
    "normalized_hebrew": "???",
    "transliteration_optional": null,
    "gloss_primary": "see",
    "gloss_alternates": [],
    "shoresh": "???",
    "part_of_speech": "verb",
    "function_vs_content": "content",
    "priority_band": "early_useful",
    "frequency_signal": "recurring_across_resources",
    "linked_skill_ids": [
      "skill_shoresh_identification",
      "skill_nikud_sensitive_distinction",
      "skill_literal_translation"
    ],
    "source_refs": [
      "R2:worksheets",
      "R3:throughout"
    ],
    "notes": "Useful for guttural-aware parsing."
  },
  {
    "vocab_id": "vocab_halakh",
    "hebrew": "???",
    "normalized_hebrew": "???",
    "transliteration_optional": null,
    "gloss_primary": "go / walk",
    "gloss_alternates": [],
    "shoresh": "???",
    "part_of_speech": "verb",
    "function_vs_content": "content",
    "priority_band": "must_master_first",
    "frequency_signal": "recurring_across_resources",
    "linked_skill_ids": [
      "skill_shoresh_identification",
      "skill_literal_translation"
    ],
    "source_refs": [
      "R2:worksheets",
      "R3:throughout"
    ],
    "notes": null
  },
  {
    "vocab_id": "vocab_bo",
    "hebrew": "???",
    "normalized_hebrew": "???",
    "transliteration_optional": null,
    "gloss_primary": "come",
    "gloss_alternates": [],
    "shoresh": "???",
    "part_of_speech": "verb",
    "function_vs_content": "content",
    "priority_band": "early_useful",
    "frequency_signal": "recurring_across_resources",
    "linked_skill_ids": [
      "skill_shoresh_identification",
      "skill_literal_translation"
    ],
    "source_refs": [
      "R2:worksheets",
      "R3:throughout"
    ],
    "notes": null
  },
  {
    "vocab_id": "vocab_hayah",
    "hebrew": "???",
    "normalized_hebrew": "???",
    "transliteration_optional": null,
    "gloss_primary": "be",
    "gloss_alternates": [
      "become"
    ],
    "shoresh": "???",
    "part_of_speech": "verb",
    "function_vs_content": "content",
    "priority_band": "early_useful",
    "frequency_signal": "recurring_across_resources",
    "linked_skill_ids": [
      "skill_shoresh_identification",
      "skill_irregular_ambiguous_form_handling"
    ],
    "source_refs": [
      "R2:worksheets",
      "R3:throughout"
    ],
    "notes": "High-frequency but often context-sensitive."
  },
  {
    "vocab_id": "vocab_asah",
    "hebrew": "???",
    "normalized_hebrew": "???",
    "transliteration_optional": null,
    "gloss_primary": "do / make",
    "gloss_alternates": [],
    "shoresh": "???",
    "part_of_speech": "verb",
    "function_vs_content": "content",
    "priority_band": "must_master_first",
    "frequency_signal": "recurring_across_resources",
    "linked_skill_ids": [
      "skill_shoresh_identification",
      "skill_literal_translation"
    ],
    "source_refs": [
      "R2:worksheets",
      "R3:throughout"
    ],
    "notes": "Bare-form shoresh questions on this token are usually low-value."
  },
  {
    "vocab_id": "vocab_yatza",